{
  "$schema": "./governance-control-recovery-request.v4.schema.json",
  "schemaVersion": "4.0-control-recovery-proposal",
  "documentType": "governance-control-recovery-request-packet",
  "controlRecoveryId": "GCR-0004",
  "title": "Recover the exact GCR-0003 R01 adverse-review projection",
  "targetWave": "W1",
  "status": "pending-human-approval",
  "executionState": "non-executable",
  "classification": "approved-bootstrap-review-transition-defect",
  "rootAuthority": {
    "basis": "repository-owner-governance-mismatch-protocol",
    "exceptionScope": "one-time-exact-review-transition-recovery-only",
    "packetReviewHistory": [],
    "approvalSchema": {
      "path": "planning/governance-control-recovery/governance-control-recovery-runtime.v4.schema.json",
      "sha256": "261f5ea6368b11f4afb76c6af3457e97d70fe4330d51e6debd4c6c7b3f305b15"
    },
    "approvalPath": "planning/governance-control-recovery/GCR-0004.approval.json",
    "authorityManifest": {
      "path": "planning/governance-control-recovery/GCR-0004.authority.json",
      "sha256": "dbe22531c8b29c8881c9a0e0b496f45c8ec64aa70de6a688fbe4b1c66fd6ed39"
    },
    "untrackedTriggerWitness": {
      "path": "artifacts/evidence/W1.A04.B00.json",
      "sha256": "4a9d944ff95972b449b617bc384306c7023e79d31d6b427e6b6f4678cd58b22c",
      "role": "atomic-failure-trigger-only",
      "mustRemainUntrackedAndUnstaged": true,
      "neverExecutionAuthority": true
    },
    "approvalIntroduction": {
      "exclusiveCreate": true,
      "trackedCleanExactBranchHead": true,
      "permittedUntracked": "exact-witness-plus-exact-adverse-ledger",
      "packetReviewApproved": true,
      "introductionCommitIsExecutionBase": true
    }
  },
  "predecessorAuthority": {
    "gcr3Packet": {
      "path": "planning/governance-control-recovery/GCR-0003.packet.json",
      "sha256": "dc6055395a409fe4a9753657522cf54181bf881c15c72ba65aa3cccd32d2a666",
      "commit": "f062cff48036bce9f094b86370a9499837f4b358"
    },
    "gcr3PacketReview": {
      "path": "planning/governance-control-recovery/GCR-0003.review-R01.json",
      "sha256": "aefba1307351916d83f4ad93959227bed4faa1792b67cda96b2f7121f9faba6a",
      "commit": "dd7da0b1c8a38a73b8a928bfe3dd2c8587369ca9"
    },
    "gcr3Approval": {
      "path": "planning/governance-control-recovery/GCR-0003.approval.json",
      "sha256": "82a6187fa47e55c286ef3ae60bd185c94dfcdf5ba87c1283391d315988528ca7",
      "commit": "d6ec319a6d9d3ccbc5fc195e91d8ee6be594ef3c"
    },
    "gcr3Candidate": "a0988d8d9cfde8cde5cc9cf148f9b37ae8e13873",
    "gcr3Evidence": {
      "path": "artifacts/evidence/governance-control-recovery/GCR-0003.B00.R01.json",
      "sha256": "381a54d41594072cd66c78d50e13ad822926c218d2df1e1ad80d60838c19815a",
      "commit": "702ffbc587cca2ec05567d86dc9fd0fa0a25b4a5"
    },
    "frozenReviewedState": {
      "path": "planning/governance-control-recovery/GCR-0003.B00.state.json",
      "sha256": "0828cb7a52ff5f739dcfbc49832e7b2437f997fced38bac917098081368328e4",
      "commit": "702ffbc587cca2ec05567d86dc9fd0fa0a25b4a5",
      "status": "REVIEW"
    },
    "adverseLedger": {
      "path": "planning/governance-control-recovery/GCR-0003.B00.review-R01.json",
      "sha256": "cdfdb2f9fc122cb1a3be3d4546542dfc108a35c96995a340d32b5ae3510ba93b",
      "reviewedStateCommit": "702ffbc587cca2ec05567d86dc9fd0fa0a25b4a5",
      "result": "changes-requested",
      "untracked": true,
      "unstaged": true,
      "executionAuthority": false
    },
    "defectiveRuntimeV3": {
      "path": "planning/governance-control-recovery/governance-control-recovery-runtime.v3.schema.json",
      "sha256": "7918c0d255074fdbfd1c400aa9e4008ad6d8efa91584a3010d59612f4cc57124",
      "packetFrozen": true,
      "mustRemainUnchanged": true
    }
  },
  "triggerEvidence": {
    "failedCommand": ".venv\\Scripts\\python.exe tools/gcr3ctl.py --repo . review GCR-0003 --reviewer independent-gcr3-b00-control-security-reviewer --from planning/governance-control-recovery/GCR-0003.B00.review-R01.json",
    "exitCode": 1,
    "diagnostic": "The exact ledger-derived CHANGES_REQUESTED state failed runtime-v3 validation because the packet-frozen state enum omits adverse statuses; the command wrote no canonical state.",
    "atomicNoMutation": true,
    "stateSha256AfterFailure": "0828cb7a52ff5f739dcfbc49832e7b2437f997fced38bac917098081368328e4",
    "ledgerSha256AfterFailure": "cdfdb2f9fc122cb1a3be3d4546542dfc108a35c96995a340d32b5ae3510ba93b",
    "independentAudit": "A read-only boundary audit confirmed that editing runtime-v3 invalidates GCR-0003 authority and that changing the normal two-file projection topology requires a new exact packet and human approval."
  },
  "activationBoundary": {
    "controlRevision": 9,
    "minimumToolRevision": 9,
    "holdId": "HOLD-W1-GRR-0002",
    "holdStatus": "ACTIVE",
    "waveStatus": "PAUSED",
    "waveScope": "wave",
    "taskId": "CAP-02.S04.T03",
    "taskStatus": "BLOCKED",
    "amendmentId": "W1.A04",
    "amendmentBacklogStatus": "ABSENT",
    "releaseGate": "G1",
    "releaseGateStatus": "PENDING"
  },
  "reviewTransition": {
    "kind": "one-time-exact-gcr3-r01-adverse-projection-recovery",
    "reviewedStateCommit": "702ffbc587cca2ec05567d86dc9fd0fa0a25b4a5",
    "result": "changes-requested",
    "controlRevisionBefore": 9,
    "controlRevisionAfter": 9,
    "normalProjectionUnavailable": true,
    "explicitRecoveryAuthority": true,
    "exactFinalChangedPaths": [
      "planning/governance-control-recovery/GCR-0003.B00.review-R01.json",
      "planning/governance-control-recovery/GCR-0003.B00.state.json"
    ],
    "postRecoveryState": "CHANGES_REQUESTED",
    "ordinaryExecutionStillDenied": true
  },
  "lifecycle": {
    "branch": "codex/w1-windows-local-runtime",
    "actor": "codex",
    "workspaceInvariant": {
      "triggerWitness": {
        "path": "artifacts/evidence/W1.A04.B00.json",
        "sha256": "4a9d944ff95972b449b617bc384306c7023e79d31d6b427e6b6f4678cd58b22c",
        "role": "atomic-failure-trigger-only",
        "mustRemainUntrackedAndUnstaged": true,
        "neverExecutionAuthority": true
      },
      "adverseLedger": "exact-untracked-unchanged-GCR-0003.B00.review-R01",
      "denyOtherUntracked": true,
      "denyStagingOrMutation": true,
      "appliesAtEveryTransition": true
    },
    "canonicalPaths": {
      "controller": "tools/gcr4ctl.py",
      "state": "planning/governance-control-recovery/GCR-0004.B00.state.json",
      "evidencePattern": "artifacts/evidence/governance-control-recovery/GCR-0004.B00.RNN.json",
      "reviewPattern": "planning/governance-control-recovery/GCR-0004.B00.review-RNN.json",
      "applicationEvidence": "artifacts/evidence/governance-control-recovery/GCR-0004.B00.application.json",
      "transactionSchema": "planning/governance-control-recovery/governance-control-recovery-transaction.v4.schema.json",
      "transaction": "planning/governance-control-recovery/GCR-0004.B00.application-transaction.json",
      "lock": "planning/governance-control-recovery/GCR-0004.B00.application.lock",
      "stateNext": "planning/governance-control-recovery/GCR-0004.B00.gcr3-state.next"
    },
    "implementation": {
      "base": "GCR-0004-approval-introduction-commit",
      "candidateAncestry": "strict-descendant",
      "exactAllowlist": true,
      "liveRevision": 9,
      "noBridgeBeforeApproval": true
    },
    "review": {
      "independent": true,
      "commitBound": true,
      "severityRanked": true,
      "blockingFindingDenial": true,
      "appendOnly": true
    },
    "application": {
      "requiresApprovedB00": true,
      "ledgerBytePreserved": true,
      "stateLedgerDerived": true,
      "explicitBridgeRecord": true,
      "crashSafe": true,
      "directChildFinalization": true,
      "exactChangedPaths": [
        "planning/governance-control-recovery/GCR-0003.B00.review-R01.json",
        "planning/governance-control-recovery/GCR-0003.B00.state.json"
      ],
      "postApplicationGate": "ordinary-GCR-0003-R02-resubmission-and-independent-review"
    },
    "commands": {
      "submit": "python tools/gcr4ctl.py --repo . submit GCR-0004 --agent codex --approval-commit <sha> --implementation-commit <sha> --evidence artifacts/evidence/governance-control-recovery/GCR-0004.B00.RNN.json",
      "review": "python tools/gcr4ctl.py --repo . review GCR-0004 --reviewer <independent-reviewer> --from planning/governance-control-recovery/GCR-0004.B00.review-RNN.json",
      "resubmit": "python tools/gcr4ctl.py --repo . resubmit GCR-0004 --agent codex --implementation-commit <sha> --evidence artifacts/evidence/governance-control-recovery/GCR-0004.B00.RNN.json",
      "apply": "python tools/gcr4ctl.py --repo . apply GCR-0004 --agent codex --approved-state-commit <sha> --evidence artifacts/evidence/governance-control-recovery/GCR-0004.B00.application.json",
      "recover": "python tools/gcr4ctl.py --repo . recover GCR-0004 --agent codex",
      "validate": "python tools/gcr4ctl.py --repo . validate GCR-0004"
    }
  },
  "bootstrapUnit": {
    "id": "GCR-0004.B00",
    "kind": "one-time-review-transition-recovery-controller",
    "exceptionReason": "The independently reviewed GCR-0003 R01 adverse result cannot be represented by its packet-frozen runtime-v3 schema, and its exact normal projection topology cannot include the required controller/schema repair.",
    "authorizedPaths": [
      "artifacts/evidence/governance-control-recovery/GCR-0004.B00*",
      "planning/governance-control-recovery/GCR-0003.B00.review-R01.json",
      "planning/governance-control-recovery/GCR-0003.B00.state.json",
      "planning/governance-control-recovery/GCR-0004.B00*",
      "quality-scope.json",
      "tests/foundation/test_gcr3ctl.py",
      "tests/foundation/test_gcr4ctl.py",
      "tools/gcr3ctl.py",
      "tools/gcr4ctl.py"
    ],
    "requiredOutcomes": [